url,date,title,changes,file_name
https://github.com/squid-cache/squid/commit/a37ec7fa9e6d67647727e3e459cadf5aa5fcecb3,20 Jan 2014,"Avoid comm.cc:170: ""Comm::IsConnOpen(conn)"" assertions
by being more careful with the client data connection state.

Do not forward a 125/150 response to the client until the client data
connection is ready. Do not forward it at all if the data connection was
already closed by the time we got a server 125/150 response. If we have to
wait, we do not really forward the original 125/150 response but generate our
own 150. That may change.",57,data/crawl/squid/patch_385.diff
https://github.com/squid-cache/squid/commit/4fb971a08a878052187adc4ad3cc22df25580b39,20 Jan 2014,"Cleanup refreshCountsStats() cache manager code

* Replace a #define macro with local static function.

* Replace pointer parameter with reference

* suppress display of histograms where there are no records and so no
  meaningful content to be displayed.",77,data/crawl/squid/patch_386.diff
https://github.com/squid-cache/squid/commit/92436224bad0bd4f005cd862c84cd2ccfd54e4c9,05 Jan 2014,Merged from upstream,6348,data/crawl/squid/patch_387.diff
https://github.com/squid-cache/squid/commit/c07db6981c05699ca1054260bb121e0c7aecd6ad,05 Jan 2014,Merged from trunk,119,data/crawl/squid/patch_388.diff
https://github.com/squid-cache/squid/commit/c24f7fb6c27201f9d5cbc5c6f19b5b061ac36b2b,05 Jan 2014,Merge from trunk,6342,data/crawl/squid/patch_389.diff
https://github.com/squid-cache/squid/commit/ef04d94cb59d5a89cb2f9c97f544b08fbf61f13e,03 Jan 2014,"Merge storeentry-refactor, fix store unit test",105,data/crawl/squid/patch_390.diff
https://github.com/squid-cache/squid/commit/04ebce5515f51ee9b8e81a6c70f3abc3aeb38302,03 Jan 2014,Got rid of Store.cci,104,data/crawl/squid/patch_391.diff
https://github.com/squid-cache/squid/commit/8af14d5e7cf0e50735a4542b3b32c2a8808cf901,02 Jan 2014,Merged from trunk,6265,data/crawl/squid/patch_392.diff
https://github.com/squid-cache/squid/commit/fa2301d26b90cbd1298eb7740e8827c7746cd9d2,01 Jan 2014,"Initial Large Rock and Collapsed Forwarding support.

Large Rock: Support disk (and shared memory) caching of responses exceeding
one db slot (or one shared memory page) in size. A single db slot/page size is
still limited to 32KB (smaller values can be configured for disk caches using
the newly added cache_dir slot-size option). Removal of old rock cache dir
(followed by squid-z) is required -- the on-disk db structure has changed.

Collapsed Forwarding: Optionally merge concurrent cachable requests for the
same URI earlier: After the request headers have been parsed (as before), but
now _before_ the response headers have been received. Merging of requests
received by different SMP workers is supported. Controlled by the new
collapsed_forwarding directive in squid.conf. Disabled by default because all
but one of the merged requests have to be delayed (until the response headers
are received) for the merging to work, which may be worse than forwarding all
concurrent requests immediately. The overall feature idea and request
eligibility conditions are based on Collapsed Forwarding in Squid2.


Summary of other important changes (merged branch log contains the details):

* Tightened StoreEntry locking. Split StoreEntry::lock() into ""just lock"" and
  ""update entry reference time"" interfaces, addressing an old XXX.  Improved
  entry lock/unlock debugging. Needs more work.

* Adjusted StoreIOState::write() API to allow callers detect write errors.

* Simplified MemObject::write() API to remove an essentially unused callback.

* Mark client streams that sent everything as STREAM_COMPLETE. The old code
  used STREAM_UNPLANNED_COMPLETE if the completed stream was associated with a
  non-persistent connection, which did not make sense to me and, IIRC, led to
  store entry aborts even though the entries were not damaged in any way.

* mem_hdr::hasContigousContentRange() now returns true for empty ranges.

* Support ""appending"" ReadWriteLock state that can be shared by readers and
  the writer. The writer promises not to update key metadata (except growing
  object size and next pointers) and readers promise to be careful when
  reading growing slices.

* Fixed StoreEntry::mayStartSwapOut() logic to handle terminated swapouts.

* Improved STORE_MEM_CLIENT detection and documented known (and mostly old)
  StoreEntry::storeClientType() problems.

* Removed StoreEntry::hidden_mem_obj hack.

* Polished StoreEntry debugging to report more info, less noise. Use e: prefix.

* Added a script to extract store entry(ies) debugging from cache.log.",6196,data/crawl/squid/patch_393.diff
https://github.com/squid-cache/squid/commit/9d4e9cfbacb7de44098f09fa2c2e6c1801dfe1ba,31 Dec 2013,SourceFormat Enforcement,265,data/crawl/squid/patch_394.diff
https://github.com/squid-cache/squid/commit/0efb166e0de7babf871c43fb57869dcd77b243f8,11 Dec 2013,Merged from trunk,8617,data/crawl/squid/patch_395.diff
https://github.com/squid-cache/squid/commit/dcd84f807886121b9c725dec786a830bd1c8afb4,06 Dec 2013,Merged from trunk 13172.,19565,data/crawl/squid/patch_396.diff
https://github.com/squid-cache/squid/commit/d4806c91642a65454c9dc6f65e7ed03e50a76313,06 Dec 2013,"Add key_extras to proxy authentication schemes.

The key_extras value is a ""quoted string"" with logformat %macro support. It is
appended to request line for the authentication helper.

Example usage:
   auth_param basic key_extras ""thePort:%>lp""
   auth_param digest key_extras ""LocalIP=%>la:%lp""

This is a Measurement Factory project.",513,data/crawl/squid/patch_397.diff
https://github.com/squid-cache/squid/commit/0a720258ebe0806d0ee7953ab35df886f867a899,29 Nov 2013,"Support libecap v1.0, allowing asynchronous adapters and eCAP version checks.

After these changes, Squid can support eCAP adapters built with libecap v1.0,
but stops supporting adapters built with earlier libecap versions (due to API
changes). The new libecap version allows Squid to better check the version of
the eCAP adapter being loaded as well as the version of the eCAP library being
used. This should help with migration to libecap v1.0.


Expose [running] main event loop as a global so that modules can add engines.",269,data/crawl/squid/patch_398.diff
https://github.com/squid-cache/squid/commit/c9dbe80fad1d56d5f186dd49f97401016ba88daf,21 Nov 2013,Bug 3782: Digest authentication not obeying nonce_max_count,14,data/crawl/squid/patch_399.diff
https://github.com/squid-cache/squid/commit/896f0b9b08b52e2cbbd9bb61afc41a725830437e,13 Nov 2013,"Add EPRT and EPSV commands to FTP FEAT response if not already there
because Squid FTP gw supports both even if the FTP origin server does not.",21,data/crawl/squid/patch_400.diff
https://github.com/squid-cache/squid/commit/89b1d7a2c87a4a12cedbf9a302a223fcdd6faefe,13 Nov 2013,"Propagate FTP server connection closures to idle FTP gw clients but
carefully close the FTP server connection upon receiving an FTP 221 response.

FTP gateway code pins server connections; when there is no traffic, the
client-side code holds on to the server connection. The old code did not
notice pinned server connection closure until it was time to write the next
FTP request to that connection. Squid now monitors the idle pinned server
connection and closes the client connection if the server connection closes
(or, to be more precise, if the server connection gets marked as ready for
reading).

Client-side monitoring of an idle pinned connection ends when the server side
starts using the pinned connection again (because the server side becomes
responsible for monitoring EOF conditions then). Added
borrowPinnedConnection() and related methods to distinguish validation of
pinned connection and responsibility transfer.

Careful closure of the FTP server connection upon receiving an FTP 221
response is necessary to avoid the client-side idle server connection
monitoring code closing the client connection upon detecting server-side EOF
_before_ the client side had enough time to forward that 221 response to the
not-yet-idle client. The latter may take some time because, in part, the
response may have to go through an ICAP RESPMOD service first.",138,data/crawl/squid/patch_401.diff
https://github.com/squid-cache/squid/commit/000e664babaf79d53f8f0a009662decebebf5c15,04 Nov 2013,"Initial support for gatewaying FTP EPRT and EPSV commands.

Client side validates the IPv6-friendly commands, but the server side
independently decides which of the four standard data connection establishment
commands to use. In practice only PASV and EPSV commands are sent because
Squid still does not support active FTP connections on the server side.

Moved EPSV- and some PASV-handling code from proxy-specific ftp.cc into
general FtpServer.cc for the client-side gateway code to reuse.",932,data/crawl/squid/patch_402.diff
https://github.com/squid-cache/squid/commit/b6a7fc859fe563a1c6b66914bc83b5081d94d7bb,01 Nov 2013,"Make Http parser incremental

This makes the parser track the start of the un-parsed buffer region and
resume parsing at that point instead of reset to the beginning.

- add state to mark completion of the first line (request-line)
- add unit test for incremental parse states including BWS
- make the state tracking member of HttpParser private",97,data/crawl/squid/patch_403.diff
https://github.com/squid-cache/squid/commit/7cc02995c18707755f9fbfd1d33da10ef73f4092,30 Oct 2013,Merged from trunk,9,data/crawl/squid/patch_404.diff
https://github.com/squid-cache/squid/commit/e87619bc9ef4a77a952bac8b54e7d6ee7f2c2356,30 Oct 2013,"CacheMgr: normalize pconn report output

- table rows start with TAB
- table cell delimiter is TAB
- table header cells start with TAB SP",9,data/crawl/squid/patch_405.diff
https://github.com/squid-cache/squid/commit/46445347f9c3f7e11cd1626599cfe7c9a18b0367,31 Oct 2013,"Implement stubs for external_acl, auth/libauth, auth/libacls, time",248,data/crawl/squid/patch_406.diff
https://github.com/squid-cache/squid/commit/9d870886ca9593d370ab493f0d85a61e88c6325d,28 Oct 2013,"End ""227 Entering Passive Mode (...)"" response with CRLF as required by FTP.",2,data/crawl/squid/patch_407.diff
https://github.com/squid-cache/squid/commit/4e3760b17d0b13ce648e48760b495fdd225a2836,27 Oct 2013,Broken: define and use stub_libauth.cc,111,data/crawl/squid/patch_408.diff
https://github.com/squid-cache/squid/commit/77f6d1d2986563d71ab09a413bdca3a61dc81422,18 Oct 2013,"Append ""Connection: close"" to OPTIONS requests when icap_persistent_connections
is off.

This brings OPTIONS requests behavior inline with REQMOD and RESPMOD.",4,data/crawl/squid/patch_409.diff
https://github.com/squid-cache/squid/commit/dfba0ccff835ebb9efc590823b68ae0877c9e0a7,04 Oct 2013,Merge SBuf.,3292,data/crawl/squid/patch_410.diff
https://github.com/squid-cache/squid/commit/b309d6a60aefd6135d15ade1e6cdc12d09ae82fa,04 Oct 2013,Merged from trunk,5928,data/crawl/squid/patch_411.diff
https://github.com/squid-cache/squid/commit/184e49edf5285b26f58302f588ffe3fb121fd10c,03 Oct 2013,Merged from trunk,1178,data/crawl/squid/patch_412.diff
https://github.com/squid-cache/squid/commit/17852883df926d74fb04fe5d2bbfa281090574a8,01 Oct 2013,"Remove dnsserver and external DNS helper API

The external DNS helper API places limits on Squid DNS lookups per second
low enough to noticably affect the HTTP requests per second which can be
served.

Request for comments about proposed removal 2 years ago produced feedback
stating that the helper was needed for local name resolution. This is
now available since 3.4 mDNS extensions.

A more recent request for reasons for keeping the helper API have
produced only two responses over the period of several months. Both
indicating that the API is no longer necessary for the business cases of
a year or so ago.

As such and because the helper fails to operate sufficiently on several
major operating systems and the API is difficult to maintain it is being
removed as of Squid-3.5.",1269,data/crawl/squid/patch_413.diff
https://github.com/squid-cache/squid/commit/73656056cdcface25c015c755e9a3688acd404fc,30 Sep 2013,"Remove COSS

This storage type has been superceded by Rock storage since 3.2.",3034,data/crawl/squid/patch_414.diff
https://github.com/squid-cache/squid/commit/4ebcf1ceefe28d5320166e5bad97a72ef7944c5c,27 Sep 2013,"negotiate_kerberos_auth: upgrade to present group= keys

Use the new kv-pair protocol extensions for emitting group details
directly at the time of authentication. group=X key-value pair is
used to emit the Kerberos SIDS values presented by MS Active
Directory environments.

Also, update the Hiemdal library support for recent library versions.

Also, polish the Kerberos and LDAP Group related code to avoid memory
leaks and improve C++ coding style.",1392,data/crawl/squid/patch_415.diff
https://github.com/squid-cache/squid/commit/ab768952b257c72e31782b83a99c4d482190d720,29 Aug 2013,"Added Expect:100-continue to FTP STOR wrappers for adaptation to avoid stalling
FTP clients that expect an FTP 150 (OK to send data) response from the FTP
server before actually uploading content.

If an adaptation service starts waiting for the PUT request body before
starting to produce an adaptation response (allowing the transaction to reach
the FTP server), the FTP transaction will get stuck. It is not clear why this
has not been a [known] issue with real HTTP requests containing
Expect:100-continue.",4,data/crawl/squid/patch_416.diff
https://github.com/squid-cache/squid/commit/a2c7f09a21c2f8424cff36953942e1f07281cc2e,29 Aug 2013,"Reorganized FTP response storage/wrapping to fix multi-line response gatewaying

Multi-line FTP control responses use various line prefixes to tell the client
that the response continues to the next line. Some multi-line responses use a
""CODE-"" line prefix. Some, like FEAT, must use a single space as a line prefix
(except for the first line that uses ""CODE-""). Squid was removing the virgin
prefix and then using ""CODE-"" prefix for all lines, breaking FEAT and probably
other responses.

While modifying original multi-line prefix was a bad idea, leaving FTP
multi-lines ""as is"" does not work either because HTTP wrapping removes leading
spaces which are significant in FEAT and other FTP responses.

Squid now preserves leading multi-lines by wrapping them using quoted strings.
Adaptation services wishing to interpret multi-lines must unquote any quoted
FTP-* header field values before adaptation and return quoted values back (if
needed).  Which FTP-* header values are quoted and which are not may be
value-dependent and may change. Quoting and unquoting requires handling of
HTTP \-CHAR escape sequences.

The last FTP response line has to be treated specially because it has [more]
strict syntax, has to be interpreted by Squid, subjected to squid.conf ACLs,
and is more likely to be adapted. Squid used to wrap all multi-lines into
multiple fields of an FTP-Reason header while only storing the ""reason"" from
the last multi-line there. That was messy, and became prohibitively so when
multi-line quoting of multi-lines was introduced.

Now Squid wraps all multi-lines except the last one using FTP-Pre header.  All
FTP-Pre lines may be wrapped as quoted strings. FTP-Status and FTP-Reason
headers are used for the FTP code and reason phrase from the last line:

  FTP-Pre: ""123-first line""
  FTP-Pre: "" second line""
  FTP-Status: 123
  FTP-Reason: from the third line

Needs more work if there are adaptation services that merge multiple FTP-Pre
header values together.",145,data/crawl/squid/patch_417.diff
https://github.com/squid-cache/squid/commit/7c293fc7fb992e937ea2f6fafaabb6a02e94f319,27 Aug 2013,"Use more portable 227 (PASV) response format.

RFC1123 says that ""The format of the 227 reply to a PASV command is not well
standardized"". Evidently, we should not use ""227 =a,b,c,d,p1,p2"" or 
""227 Entering Passive Mode. A1,A2,A3,A4,a1,a2"" formats. Some nf_ct_ftp
versions block responses that use those alternative syntax rules!",7,data/crawl/squid/patch_418.diff
https://github.com/squid-cache/squid/commit/73950ceb1794fada8d593195d05155345bd7afca,27 Aug 2013,Merged from trunk r12948.,16213,data/crawl/squid/patch_419.diff
https://github.com/squid-cache/squid/commit/7f15543d7ffd5f28f0569b2da4044d541c728956,23 Aug 2013,"Render adaptation X-Response-Info and X-Response-Desc meta values in FTP errors
caused by adaptation (e.g., an ICAP service blocking an FTP command)

Requires adaptation history to be enabled, which can be achieved by logging
adaptation meta headers to access log (%adapt::<last_h) or setting
adaptation_masterx_shared_names in squid.conf

Long term, the contents of the error message should be configurable via
error message templates (which may include these semi-standard meta headers).",73,data/crawl/squid/patch_420.diff
https://github.com/squid-cache/squid/commit/cabb71673183cfc613e69daad66c661338f6e468,23 Aug 2013,"When writing FTP errors to the client, omit ERR_NONE error name.",3,data/crawl/squid/patch_421.diff
https://github.com/squid-cache/squid/commit/ad70acff8f82012b09ec2628ab522de4922d08cd,23 Aug 2013,"Provide user with more details on forwarding/adaptation errors.

In addition to ""421 Service Unavailable"", print %c and %E errorpage info.
Needs more work to make FTP error messages configurable, just like they are
for HTTP.",26,data/crawl/squid/patch_422.diff
https://github.com/squid-cache/squid/commit/cff221eee04e679b0aff9b7455a0a3cc7fb08166,23 Aug 2013,"Initial support for active FTP downloads via the FTP PORT command.

Squid accepts PORT command on the client side, but still uses passive transfer
on the server side. The PORT command response is not sent to the client until
the server-side PASV command succeeds. The data connection to the client is
not opened until Squid receives the RETR command from the client.

Squid requires either PORT or PASV command before data transfers. RFC 959 says
PORT is optional because default ports can be used. 

RFC 959 also seems to imply that Squid should originate active connections to
client from port 20.  The code to do that is commented out for now because it
would prevent support for concurrent data connections. The code configuring
this outgoing (but to-client) connection may need more work as we do a lot
more for outgoing to-server connections.

Active data upload has not been tested.",239,data/crawl/squid/patch_423.diff
https://github.com/squid-cache/squid/commit/1f90fd4aa8b3e2e06018d15de0da5eeb3e8ba2fb,15 Aug 2013,Merged from trunk r12948.,16330,data/crawl/squid/patch_424.diff
https://github.com/squid-cache/squid/commit/397d2d61cf76167934616514a037bd4730319eb0,09 Aug 2013,"Display Build-Info in cache manager info report

This info can be quite useful for tracking which patched build of Squid
is being used to produce the report.",2,data/crawl/squid/patch_425.diff
https://github.com/squid-cache/squid/commit/bce61b006f1ea12de90966ae6b7ff88372d905cf,01 Aug 2013,"Add dns_multicast_local to control mDNS operation

Enable admin control over whether mDNS operates or not. Set the default
to OFF due to .arpa reverse-DNS requests causing a rise in traffic from
this feature even on networks without mDNS responders setup.

Also, polish cachemgr idns report to show for queued queries which
resolver type and query the entry is involving. mDNS can cause a queue
to exist as some lookups timeout on the mDNS resolvers.",52,data/crawl/squid/patch_426.diff
https://github.com/squid-cache/squid/commit/01aed79c466257a5c7c5ee0104224bd2d4107724,29 Jul 2013,"Better support for things with shared locks that can be opened many times,
such as Ipc::StoreMap entries. Maintain a lock counter instead of boolean 
opened flag.

Better support for things with multipart IDs
such as Ipc::StoreMap entries that have an anchor/inode ID and map name.

Support searching for shared pages (sh_page).",35,data/crawl/squid/patch_427.diff
https://github.com/squid-cache/squid/commit/0ad3ff513e423e6d05f4a50995166d6440975cc6,27 Jul 2013,"Handle infinite certificate validation loops caused by OpenSSL bug #3090.

If OpenSSL is stuck in a validation loop, Squid breaks the loop and triggers a
new custom SQUID_X509_V_ERR_INFINITE_VALIDATION SSL validation error. That
error cannot be bypassed using sslproxy_cert_error because to break the loop
Squid has to tell OpenSSL that the certificate is invalid, which terminates
the SSL connection.

Validation loops exceeding SQUID_CERT_VALIDATION_ITERATION_MAX iterations
are deemed infinite. That macro is defined to be 16384, but that default can
be overwritten using CPPFLAGS.

This is a Measurement Factory project",96,data/crawl/squid/patch_428.diff
https://github.com/squid-cache/squid/commit/1d9500c451381b0471bdbb02870738a1511b9f95,26 Jul 2013,Merged from trunk,144,data/crawl/squid/patch_429.diff
https://github.com/squid-cache/squid/commit/eb6ac8089e8b4157aad32f3e4616569746ffe6f3,26 Jul 2013,"Update the http(s)_port directives protocol= parameter

... to use AnyP::ProtocolVersion for internal storage instead of opaque
string text.

This both limits the possible parameter values to one of HTTP, HTTP/1.1,
HTTPS or HTTPS/1.1 and ensures that URLs generated from that protocol
parameter value are http:// and https:// URL. 
Other values will cause Squid to abort.",107,data/crawl/squid/patch_430.diff
https://github.com/squid-cache/squid/commit/eeac7afbd68ca5b2dbf02933070812f57fcc14fb,24 Jul 2013,Merged from trunk,2836,data/crawl/squid/patch_431.diff
https://github.com/squid-cache/squid/commit/2eceb328ef857482d29d0b170856bf6213015c1c,21 Jul 2013,"Quoted values in squid.conf

This patch :
  - adds support for quoted values in the entire squid.conf
  - warn about or prohibit values that can no longer be interpreted as 
    either quoted strings or simple tokens
  - support parameters(""/path/to/file.name"") syntax to load external
    configuration files
  - Checks if macros allowed in ""double quoted"" values. 
  - replaces the strtok() calls with calls to the new ConfigParser::NextToken()
  - modify strtokFile to use new ConfigParser::NextToken()
  - Add the new configuration_includes_quoted_values configuration option, to
    control the squid parser behaviour. If set to on Squid will recognize each
    ""quoted string"" after a configuration directive as a single parameter

This is a Measurement Factory project",810,data/crawl/squid/patch_432.diff
https://github.com/squid-cache/squid/commit/e5433948164cec8919bb0337bf92ab4a0f94bc73,09 Jul 2013,Added a script to extract store entry(ies) debugging from cache.log.,273,data/crawl/squid/patch_433.diff
https://github.com/squid-cache/squid/commit/bc8616155f2d9f972fc5cf06843ff61f3ab6c3ab,04 Jul 2013,Merged changes since Apr 2013 review,2743,data/crawl/squid/patch_434.diff
https://github.com/squid-cache/squid/commit/752fd8d290e36f1baed312b7ffcd49d9a0fc4925,01 Jul 2013,Add mem-cache and transient store entry details in mgr:objects output.,11,data/crawl/squid/patch_435.diff
https://github.com/squid-cache/squid/commit/a5d444a57a4113814cf0ac92f14a785168431b3b,25 Jun 2013,"FTP gateway: upload support.

The patch adds support for FTP upload commands: STOR, APPE and STOU.",208,data/crawl/squid/patch_436.diff
https://github.com/squid-cache/squid/commit/ce49546edf8ac2286db4c5989f2c00c020c69ff7,07 Jun 2013,"Support ""appending"" read/write lock state that can be shared by readers
and writer. Writer promises not to update key metadata (except growing
object size and next pointers) and readers promise to be careful when
reading growing slices.


Support copying of partially cached entries from the shared memory cache to
local RAM. This is required for collapsed shared memory hits to receive new
data during broadcasted updates.

Properly unlock objects in the shared memory cache when their entries are
abandoned by a worker. This was not necessary before because we never locked
memory cache entries for more than a single method call. Now, with partially
cached entries support, the locks may persist much longer.

Properly delete objects from the shared memory cache when they are purged by a
worker. Before this change, locally purged objects may have stayed in the
shared memory cache.


Update disk cache index _after_ the changes are written to disk. Another
worker may be using that index and will expect to find the indexed slices on
disk. Disk queues are not FIFOs across workers.


Made CollapsedForwarding work better in non-SMP mode.

Polished broadcasting code. We need to broadcast entry key because the entry
may not have any other information (it may no longer be cached by the sender,
for example).

Implemented ""anchoring"" in-transit entries when the writer caches the
corresponding object. This allows the reader's entry object to reflect its
cached status and, hence, be able to ask for cached data during broadcasted
entry updates. Still need to handle the case where the writer does not cache
the object (by aborting collapsed hit).",672,data/crawl/squid/patch_437.diff
https://github.com/squid-cache/squid/commit/dd0cbc6432f5abf6be86d4bcdd239cd86cd69b9f,05 Jun 2013,"Redo r12887 (bug 2066 fix) which introduced several related bugs:

  - fatal() if chroot is given
  - no chdir to / after chroot if coredump_dir is given
  - wrong detection of ""none"" coredump_dir
  - chdir to uninitialized pathbuf if no chroot is given

This emergency fix helps Squid start better but may need more testing/work.",36,data/crawl/squid/patch_438.diff
https://github.com/squid-cache/squid/commit/827eb0ac434b48a48954f2338258663a05231367,05 Jun 2013,SourceFormat Enforcement,2,data/crawl/squid/patch_439.diff
