url,date,title,changes,file_name
https://github.com/squid-cache/squid/commit/9a03c44bb897241473997e57d33656add9f8ee71,01 Mar 2018,"Use va_copy() on all platforms; fixed a dangerous low-level bug (#160)

To improve cross-compilation support and to simplify code, rely on C++11
cstdarg header instead of ./configure-time va_copy() detection.

Using ./configure-time detection for va_copy() is dangerous because when
it does not work (e.g., during a poorly configured cross-compilation
attempt), Squid may crash if va_copy() was needed but was not detected.

See also: Bug 4821 and bug 753.

Also found and fixed a low-level bug: StoreEntry::vappendf() was not
using va_copy() because store.cc lacked VA_COPY #defines. The affected
code (900+ callers!) is used for cache manager responses and Gopher
gateway response compilation. If any of those calls required a buffer
larger than 4KB, the lack of those va_copy() calls could lead to crashes
and/or data corruption issues on platforms where va_copy() is required.",114,data/crawl/squid/patch_0.diff
https://github.com/squid-cache/squid/commit/51e09c08a5e6c582e7d93af99a8f2cfcb14ea9e6,01 Feb 2018,"TLS: GnuTLS implementation for listening ports and client connections (#81)

Move the http_port cert= and key= options logic to libsecurity and add GnuTLS implementation for PEM file loading. Also adds some extra debugging to clarify listening port initialization problems with the PEM files.

Enable most of the http(s)_port listening socket logic to always build except where OpenSSL-specific dependency still exists. It may seem reasonable to leave it optionally excluded for minimal builds, however a minimal proxy that does not support HTTPS in any way is increasingly useless in the modern web so preference is given to building the generic TLS related code. This also simplifies the required testing to detect code portability issues.

GnuTLS implementation is added for https_port configured with static cert=/key= parameters and the resulting TLS handshake behaviour. Squid built with GnuTLS can now act as useful parent proxies behind a SSL-Bump'ing frontend or for other clients which require a TLS explicit proxy.

Also fixes the definitions for the CertPointer and PrivateKeyPointer.",769,data/crawl/squid/patch_1.diff
https://github.com/squid-cache/squid/commit/799b66d1964c2ad925f9e6cb71b1c287da3e16d7,18 Jan 2018,"ESI: remove custom parser (#128)


Alex Rousskov:
  let's consider removing the custom ESI parser from Squid. It is of
terrible quality and ""nobody"" is testing ESI code when things change. Is
the CVE risk worth supporting few platforms that do not have the right
parser libraries?

* Fixed configure.ac tests for ESI libraries",491,data/crawl/squid/patch_2.diff
https://github.com/squid-cache/squid/commit/4d27d0ab7be057352a6a5d552f85a4181f1153a5,17 Nov 2017,"Relay peer CONNECT error status line and headers to users (#80)

Automated agents and human users (or their support staff!) often benefit
from knowing what went wrong. Dropping such details is a bad default.
For example, automation may rely on receiving the original status code.

Our CVE-2015-5400 fix (74f35ca) was too aggressive -- it hid all peer
errors behind a generic 502 (Bad Gateway) response. Pass-through peer
authentication errors were later (971003b) exposed again, but our CVE
fix intent was _not_ to hide _any_ peer errors in the first place! The
intent was to close the connection after delivering the error response.
Hiding peer errors was an (unfortunate) implementation choice.

It could be argued that some peer errors should not be relayed, but
since Squid successfully relayed all peer errors prior to 74f35ca and
continues to relay all non-CONNECT peer errors today, discriminating
peer errors is a separate (and possibly unnecessary) feature.

Ideally, Squid should mangle and relay the whole error message (instead
of sending small original headers). Squid should also relay 1xx control
messages while waiting for the final response. Unfortunately, doing so
properly, without reopening CVE-2015-5400 or duplicating a lot of
complex code, is a huge project. This small change fixes the most acute
manifestation of the ""hiding errors from users"" problem. The rest is a
long-term TODO.",12,data/crawl/squid/patch_3.diff
https://github.com/squid-cache/squid/commit/cf487124163a9a460ad78f5a482a5fd90fcf9cce,02 Nov 2017,"Move TLS/SSL http_port config values to libsecurity (#51)

These are most of the minor shuffling prerequisite for the proposal to allow generate-host-certificates to set a CA filename. These are required in libsecurity in order to prevent circular dependencies between libsecurity, libssl and libanyp.

Also contains some improvements to how configuration errors are displayed for these affected settings and some bugs fixed where the configured values were handled incorrectly.",608,data/crawl/squid/patch_4.diff
https://github.com/squid-cache/squid/commit/4ec218d55249c6edd2a4fe4511212a721c98394b,22 Jul 2017,"Cleaned up net_db structures. Made Coverity happier? (#27)

Fixes false positive by Coverity Scan. Issue 1415048 (RESOURCE_LEAK)?

No runtime testing.",22,data/crawl/squid/patch_5.diff
https://github.com/squid-cache/squid/commit/fd9c47d1075b4b01e9a283c2fd67c5958b5060c5,12 Jul 2017,"Happy Eyeballs: Deliver DNS resolution results to peer selection ASAP.

To make eyeballs happy, DNS code must deliver each lookup result to the
IP cache and, ultimately, to upper layers of ipcache_nbgethostbyname()
callers. This requires changing two interfaces:

1. between the DNS and the IP cache (the IDNSCB callback);
2. between the IP cache and peer selection code (the IPH callback).

The IDNSCB callback is now called after every usable A and AAAA lookup
instead of waiting for both answers. The IPH callback now has a sister
API for incremental delivery: The Dns::IpReceiver class.

To safely handle incremental delivery of IP addresses to the IP cache, I
upgraded ipcache_addrs from an equivalent of a C POD to a C++ CachedIps
container. The encapsulation allowed me to clearly separate the two IP
cache iteration APIs:

* All IPs (used by, e.g., ACL matching and host verification code) and
* just the ""good"" IPs (used only for peer selection for now).

CachedIps stores IPs together with their good/bad status in a single
std::vector. Eventually, the CachedIp element may be extended to store
TTL. The following implementation alternatives were considered and
rejected (at least for now) while optimizing for the ""a few (and usually
just one), usually good IPs"" case:

* Using std::list or std::deque storage would consume more RAM[1] for
  the common case of one (or few) IPs per name and slowed down IPs
  iteration code.
  [1] http://info.prelert.com/blog/stl-container-memory-usage
* Separating IP from its status, like the old code did, would make it
  easier to mismatch IP and its status, make it harder to add more
  metadata like per-IP TTL, and only save memory when storing many IPs
  per name.

The drawback of the selected ""all IP-related info in one place"" approach
is that we need smart iterators (e.g., the added GoodIpsIterator) or a
visitor API.

I added a new interface class for the incremental notification about
newly found IP addresses (Dns::IpReceiver) instead of adding second
IPH-like function pointer because we cannot safely call cbdata-protected
functions multiple times for the same cbdata object -- only
cbdataReferenceValidDone() dereferences the opaque pointer properly, and
that function cannot be called repeatedly. CbcPointer solves that
problem (but requires a class). Class methods also allow for more
precise notifications, with fewer ifs in the recipient code.

The new IpCacheLookupForwarder class hides the differences between the
old C-style IPH callbacks and the new Dns::IpReceiver. Eventually, we
may be able to move all lookup-specific data/methods into
IpCacheLookupForwarder, away from the IP cache entries where that info
is useless at best.

mgr:ipcache no longer reports ""IPcache Entries In Use"" but that info is
now available as ""cbdata ipcache_entry"" row in mgr:mem.

Do not cache IPv6 /etc/hosts addresses when IPv6 support is disabled.
This change simplified code, made it more consistent (we did not cache
AAAA records), and fixed ipcacheCycleAddr() and ipcacheMarkAllGood()
that were clearing supposed-to-be-permanent ""bad (IPv6 disabled)"" marks.

Also fixed two DNS TTL bugs. Squid now uses minimum TTL among all used
DNS records[2]. Old ipcacheParse() was trying to do the same but:
* could overwrite a zero TTL with a positive value
* took into account TTLs from unused record types (e.g., CNAME).
[2] Subject to *_dns_ttl limits in squid.conf, as before.

Also fixed ""delete xstrdup"" (i.e., malloc()ed) pointer in bracketed IP
parsing code (now moved to Ip::Address::FromHost()).

Also prohibited duplicate addresses from entering the IP cache. Allowing
duplicates may be useful for various hacks, but the IP cache code
assumes that cached IPs are unique and fails to mark bad repeated IPs.

Also fixed sending Squid Announcements to unsupported/disabled IPv6
addresses discovered via /etc/hosts.

Also slightly optimized dstdomain when dealing with IP-based host names:
The code now skips unnecessary Ip::Address to ipcache_addrs conversion.
This simplification may also help remove the ipcacheCheckNumeric() hack.
The bracketed IP parsing code was moved to Ip::Address::fromHost(). It
still needs a lot of love.",1298,data/crawl/squid/patch_6.diff
https://github.com/squid-cache/squid/commit/621f4299cbf34e3daf591d314cf1c14496d5f0d1,10 Jul 2017,"TLS: move X509_NAME_STACK_Pointer to Security::ServerOptions

This Pointer is only used by the Server port options.

No GnuTLS support added in this patch, just a straight shuffle
of the OpenSSL code.",182,data/crawl/squid/patch_7.diff
https://github.com/squid-cache/squid/commit/72ed59794689bb3006d1ea6f20e060ed8259e3d3,08 Jul 2017,Cleanup: remove many unused-parameter warnings from tests and stubs,194,data/crawl/squid/patch_8.diff
https://github.com/squid-cache/squid/commit/37cb257b0ca7224c1b556c205f2a9c25a2acc1a3,08 Jul 2017,Validate mime icon URL before allocating store entries,10,data/crawl/squid/patch_9.diff
https://github.com/squid-cache/squid/commit/9e167fa2396d9469017d2ff4c5a3ded5a5b58317,18 Jun 2017,"Cleanup: remove many whitespace typos

... caught by astyle 2.06 but ignored by 2.04",158,data/crawl/squid/patch_10.diff
https://github.com/squid-cache/squid/commit/52af54dd4e55d9241339d3851c92191463ef4524,17 Jun 2017,SourceFormat Enforcement,160,data/crawl/squid/patch_11.diff
https://github.com/squid-cache/squid/commit/4eac3407573794dec7f40816dc1f1f3139c2e63e,12 Jun 2017,"Support for --long-acl-options

The old single-letter ACL ""flags"" code was refactored to support long option
names (with option-specific value types) without significant
per-ACL-object performance/RAM overheads and without creating a global
registry for all possible options. This refactoring (unexpectedly)
resulted in removal of a lot of unreliable static initialization code.

Refactoring fixed ACL flags parsing code that was dangerously misinterpreting
-i and +i flags in several contexts. For example, each of the three cases
below was misinterpreted as if three domains were configured (e.g., ""+i"",
""-z"", and ""example.com"") on each line instead of one domain (""example.com""):

        acl parsedAsThreeDomains dstdomain +i -i .example.com
        acl parsedAsThreeDomains dstdomain -i +i .example.com
        acl parsedAsThreeDomains dstdomain +i -z .example.com

TODO: Finish ACL::clone() removal. Then consider removing any unused
ACLData::clone() and associated ACL/ACLData copying methods.

This is a Measurement Factory project.",2858,data/crawl/squid/patch_12.diff
https://github.com/squid-cache/squid/commit/89d897e150e431e130d6e9710834b4e475411068,07 Jun 2017,"Improve config parsing of logformat definitions

Squid has for some time ignored custom definitions using the same name
as internally defined formats. And overwritten custom formats when there
was a repeated definition.

* Detect logformat duplicates and produce ERROR message indicating the
  format name, config line and action taken.

* Add some missing FATAL labels on parse abort when access_log has
  multiple logformat= options configured.

* Add missing FATAL error message when logformat lines has no name
  parameter (and thus no tokens either).

* Omit the default ""logformat=squid"" option from cachemgr config dumps.",26,data/crawl/squid/patch_13.diff
https://github.com/squid-cache/squid/commit/dcaa51f413ef42f3bad0504c91c15baa358f107d,29 May 2017,"Add OpenSSL library details to -v output

This is partially to meet the OpenSSL copyright requirement that binaries
mention when they are using the library, and partially for admin to see
which library their Squid is using when multiple are present in the system.",4,data/crawl/squid/patch_14.diff
https://github.com/squid-cache/squid/commit/e99fa721fc2a16026d284336fabe66db4518c3e5,23 May 2017,"Make PID file check/creation atomic to avoid associated race conditions.

After this change, if N Squid instances are concurrently started shortly
after time TS, then exactly one Squid instance (X) will run (and have
the corresponding PID file). If another Squid instance has already been
running (with the corresponding PID file) at TS, then X will be that
""old"" Squid instance. If no Squid instances were running at TS, then X
will be one of those new N Squids started after TS.

Lack of atomic PID file operations caused unexpected Squid behavior:
* Mismatch between started Squid instance and stored PID file.
* Unexpected crashes due to failed allocation of shared resources,
  such as listening TCP ports or shared memory segments.

A new File class guarantees atomic PID file operations using locks. We
tried to generalize/reuse Ssl::Lock from the certificate generation
helper, but that was a bad idea: Helpers cannot use a lot of Squid code
(e.g., debugs(), TextException, SBuf, and enter_suid()), and the old
Ssl::Lock class cannot support shared locking without a major rewrite.

File locks on Solaris cannot work well (see bug #4212 comment #14), but
those problems do not affect PID file management code. Solaris- and
Windows-specific File code has not been tested and may not build.

Failure to write a PID file is now fatal. It used to be fatal only when
Squid was started with the -C command line option. In the increasingly
SMP world, running without a PID file leads to difficult-to-triage
errors. An admin who does not care about PID files should disable them.

Squid now exits with a non-zero error code if another Squid is running.


Also removed PID file rewriting during reconfiguration in non-daemon
mode. Squid daemons do not support PID file reconfiguration since trunk
r13867, but that revision (accidentally?) left behind half-broken
reconfiguration code for non-daemon mode. Fixing that code is difficult,
and supporting PID reconfigure in non-daemons is probably unnecessary.

Also fixed ""is Squid running?"" check when kill(0) does not have
permissions to signal the other instance. This does happen when Squid is
started (e.g., on the command line) by a different user than the user
Squid normally runs as or, perhaps, when the other Squid instance enters
a privileged section at the time of the check (untested). The bug could
result in undelivered signals or multiple running Squid instances.

These changes do not alter partially broken enter/leave_suid() behavior
of main.cc. That old code will need to be fixed separately!

PID file-related cache.log messages have changed slightly to improve
consistency with other DBG_IMPORTANT messages and to simplify code.
Squid no longer lies about creating a non-configured PID file. TODO:
Consider lowering the importance of these benign/boring messages.


* Terminal errors should throw instead of calling exit()

Squid used to call exit() in many PID-related error cases. Using exit()
as an error handling mechanism creates several problems:

1. exit() does not unwind the stack, possibly executing atexit()
   handlers in the wrong (e.g., privileged) context, possibly leaving
   some RAII-controller resources in bad state, and complicating triage;
2. Using exit() complicates code by adding a yet another error handling
   mechanism to the (appropriate) exceptions and assertions.
3. Spreading exit() calls around the code obscures unreachable code
   areas, complicates unifying exit codes, and confuses code checkers.

Long-term, it is best to use exceptions for nearly all error handling.
Reaching that goal will take time, but we can and should move in that
direction: The adjusted SquidMainSafe() treats exceptions as fatal
errors, without dumping core or assuming that no exception can reach
SquidMainSafe() on purpose. This trivial-looking change significantly
simplified (and otherwise improved) PID-file handling code!

The fatal()-related code suffers from similar (and other) problems, but
we did not need to touch it.

TODO: Audit catch(...) and exit() cases [in main.cc] to take advantage
of the new SquidMainSafe() code supporting the throw-on-errors approach.",1038,data/crawl/squid/patch_15.diff
https://github.com/squid-cache/squid/commit/0ce8e93bd91ba176e1f27087a9e5ed6481e7d24a,12 Apr 2017,"Count failures and use peer-specific connect timeouts when tunneling.

Fixed two bugs with tunneling CONNECT requests (or equivalent traffic)
through a cache_peer:

1. Not detecting dead cache_peers due to missing code to count peer
   connect failures. TLS/SSL-level failures were detected (for ""tls""
   cache_peers) but TCP/IP connect(2) failures were not (for all peers).

2. Origin server connect_timeout used instead of peer_connect_timeout or
   a peer-specific connect-timeout=N (where configured).

The regular forwarding code path does not have the above bugs. This
change reduces code duplication across the two code paths (that
duplication probably caused these bugs in the first place), but a lot
more work is needed in that direction.

The 5-second forwarding timeout hack has been in Squid since
forward_timeout inception (r6733). It is not without problems (now
marked with an XXX), but I left it as is to avoid opening another
Pandora box. The hack now applies to the tunneling code path as well.",194,data/crawl/squid/patch_16.diff
https://github.com/squid-cache/squid/commit/90be6ff518647d4980ad6b725b1279da082cc7ee,23 Mar 2017,"Fix appending Http::HdrType::VIA code duplication

... resolving Via header truncation at 1024 bytes.

Also fixes the generated Via values for non-HTTP protocols.",63,data/crawl/squid/patch_17.diff
https://github.com/squid-cache/squid/commit/5d3aafbed3edd9d4cc50d9f276010c51c6b942fe,20 Feb 2017,Sync with v5 rev.15058,1995,data/crawl/squid/patch_18.diff
https://github.com/squid-cache/squid/commit/b27668ec6cfce0b56ca6d8ef4b887207f4ecc6b7,19 Feb 2017,"Add response delay pools feature for Squid-to-client speed limiting.

The feature restricts Squid-to-client bandwidth only.  It applies to
both cache hits and misses.

  * Rationale *

  This may be useful for specific response(s) bandwidth limiting.
  There are situations when doing this is hardly possible
  (or impossible) by means of netfilter/iptables operating with
  TCP/IP packets and IP addresses information for filtering. In other
  words, sometimes it is problematic to 'extract' a single response from
  TCP/IP data flow at system level. For example, a single Squid-to-client
  TCP connection can transmit multiple responses (persistent connections,
  pipelining or HTTP/2 connection multiplexing) or be encrypted
  (HTTPS proxy mode).

  * Description *

  When Squid starts delivering the final HTTP response to a client,
  Squid checks response_delay_pool_access rules (supporting fast ACLs
  only), in the order they were declared. The first rule with a
  matching ACL wins.  If (and only if) an ""allow"" rule won, Squid
  assigns the response to the corresponding named delay pool.

  If a response is assigned to a delay pool, the response becomes
  subject to the configured bucket and aggregate bandwidth limits of
  that pool, similar to the current ""class 2"" server-side delay pools,
  but with a brand new, dedicated ""individual"" filled bucket assigned to
  the matched response.

  The new feature serves the same purpose as the existing client-side
  pools: both features limit Squid-to-client bandwidth. Their common
  interface was placed into a new base BandwidthBucket class.  The
  difference is that client-side pools do not aggregate clients and
  always use one bucket per client IP. It is possible that a response
  becomes a subject of both these pools. In such situations only matched
  response delay pool will be used for Squid-to-client speed limiting.

  * Limitations *

  The accurate SMP support (with the aggregate bucket shared among
  workers) is outside this patch scope. In SMP configurations,
  Squid should automatically divide the aggregate_speed_limit and
  max_aggregate_size values among the configured number of Squid
  workers. 

  * Also: *

  Fixed ClientDelayConfig which did not perform cleanup on
  destruction, causing memory problems detected by Valgrind. It was not
  possible to fix this with minimal changes because of linker problems
  with SquidConfig while checking with test-builds.sh. So I had
  to refactor ClientDelayConfig module, separating configuration code
  (old ClientDelayConfig class) from configured data (a new
  ClientDelayPools class) and minimizing dependencies with SquidConfig.",1109,data/crawl/squid/patch_19.diff
https://github.com/squid-cache/squid/commit/b5db97e7aa415bd1630a7d47d59d7ea88aa0d17b,14 Feb 2017,"Fix memory leak and parse handling error introduced by r15024.

* Do not leak Note::Value::Value::valueFormat.
* Throw if annotation value parsing failures.

Detected by Coverity Scan:
 * CID 1399758:  Error handling issues (CHECKED_RETURN)
 * CID 1399759:  Resource leaks (CTOR_DTOR_LEAK)",8,data/crawl/squid/patch_20.diff
https://github.com/squid-cache/squid/commit/46e791c629e44630fe6e1df32bb0d73f10b1299d,08 Feb 2017,"digest_ldap_auth: Add -r option to clamp the realm to a fixed value

Some historic Digest Auth implementations do not include the realm in the
digest password attribute. The password is effectively stored as ""HA1""
instead of ""REALM:HA1"".

The realm cannot simply be ignored due to:
 1) the realm is both the salting value used within the hash and the
scope limitation on what inputs from HTTP are used to compare against
the A1, and
 2) Squid does not itself verify the realm received was the one offered
and leaves the comparison to the backend system. There is some
possibility the authentication system is using multiple security realms
and Squids realm string is just an offer.


Not having realm tied to the credentials in the backend storage leaves
this particular helper with no other option but to trust the realm sent
(probably) over clear-text by any client/attacker actually matches the
salting. That allows remote senders to manipulate the realm string they
send to perform a collision attack against the stored password.
 They no longer have to find and prove knowledge of the password. But
just find a collision for its hash vs arbitrary realm strings.

Old Digest systems are not the safest things to begin with. They also
tend to use MD5 hashing which was the only one available for many years
and relatively easy to find collisions for.


To resolve all these problems allow the -l parameter to accept an empty
string ('-l """" ') when the -r option provides a fixed realm.

Also, fix several typos in the help text.",25,data/crawl/squid/patch_21.diff
https://github.com/squid-cache/squid/commit/40fc161851f5809741ddb4774e7c366d23323a97,05 Feb 2017,Sync from v5 r15034,2231,data/crawl/squid/patch_22.diff
https://github.com/squid-cache/squid/commit/3f5b28fe18637452647d7000a0ac21103f8b660e,05 Feb 2017,"Crypto-NG: initial GnuTLS support for encrypted server connections

Make significant changes to how the options= config settings are
handled internally since GnuTLS does not expose the priority_t
implementation details like OpenSSL. They are also applied to the
session object instead of to the context.

The Security::SessionPointer is converted to std::shared_ptr. This is
required because GnuTLS does not expose the locking like OpenSSL. Since
we store the SessionPointer to fde::Table::ssl we can always access it
from there one way or another and there is actually no need for OpenSSL
locking sessions now.

Most of the remaining session lifecycle logic is moved to
security/Session.* and given a generic API. Only some client-connection
and SSL-Bump related setup remains in ssl/.

A fair amount more debug is added along with some text changes doing
s/SSL/TLS/ in code comments and debug outputs.",780,data/crawl/squid/patch_23.diff
https://github.com/squid-cache/squid/commit/6f9a30f86fd6046d371dbdeab23a2781219f0a04,30 Jan 2017,"Fix Auth::UserRequest::denyMessage() misuse.

This method was improperly used in contexts where actually
Auth::UserRequest::setDenyMessage() expected. Probably the reason was
that both denyMessage() and getDenyMessage() were not constant,
provoking such 'misuse'.

Also placed some common code into UserRequest::denyMessageFromHelper(),
eliminating code duplication. Though there are still many places
where code is duplicated inside auth/ntlm/UserRequest.cc and
auth/negotiate/UserRequest.cc.",69,data/crawl/squid/patch_24.diff
