url,date,title,changes,file_name
https://github.com/squid-cache/squid/commit/0263742023e4872c0db3b6cfd13df08c2e4673c1,23 Sep 2009,Merg from trunk,1314,data/crawl/squid/patch_749.diff
https://github.com/squid-cache/squid/commit/9969d2a86131e2a350eced6677c5fc03ad16cb5b,19 Sep 2009,"Author: Peter Pramberger <peter@pramberger.at>
Bug 2761: Gopher and double HTTP response header",66,data/crawl/squid/patch_750.diff
https://github.com/squid-cache/squid/commit/f54f527e1ba07927377e9398827b9cdf400a1303,16 Sep 2009,"Author: Source Maintenance
SourceFormat enforcement",957,data/crawl/squid/patch_751.diff
https://github.com/squid-cache/squid/commit/6989c6dcc2a01b8147d6d92ff8d3508aa3d7a647,11 Sep 2009,"Author: Markus Moeller <huaraz@moeller.plus.com>
Kerberos helepr updates.",33,data/crawl/squid/patch_752.diff
https://github.com/squid-cache/squid/commit/59bce1e80b711c4bc7c7ad5642e3ca227dced424,07 Sep 2009,"Author: Henrik Nordstrom <hno@squid-cache.org>
Bug 2510: digest_ldap_auth uses incorrect logic with TLS",8,data/crawl/squid/patch_753.diff
https://github.com/squid-cache/squid/commit/3ad12bdabcfe9732e94fdce1ea44f2c75a94fb58,04 Sep 2009,New squid_kerb_auth from Markus Moeller,5968,data/crawl/squid/patch_754.diff
https://github.com/squid-cache/squid/commit/dfeb186b8c66502b97aab952b1b049014c02a733,04 Sep 2009,"Bundle helpers for url_rewrite

Adds the --enable-url-rewrite-helpers configure time option.
see release notes or ./configure help text.

Bundles two 'fake' helpers with exemplar code for shell and C++ coding:

 url_fake_rewrite
	- C++ helper with old non-concurrent protocol.

 url-fake-rewrite.sh
	- shell helper with concurrent and non-concurrent protocols.


Also, some polishing is done to debug code for helpers.",390,data/crawl/squid/patch_755.diff
https://github.com/squid-cache/squid/commit/9ca29d23f7c7ebdb9f7fc6d360b0119ca2b7a09f,04 Sep 2009,"Author: Markus Moeller <huaraz@moeller.plus.com>
Support Kerberos login to peers

In some setups the upstream proxy requires a secue authentication method
(Negotiate, NTLM). Allow this with Negotiate/Kerberos.",828,data/crawl/squid/patch_756.diff
https://github.com/squid-cache/squid/commit/ec85ebda81e7645a60fd0cc947a10754a668c55e,03 Sep 2009,Fix some build errors,86,data/crawl/squid/patch_757.diff
https://github.com/squid-cache/squid/commit/96e03dd843bf82abfefbb46b3275154853ada1d4,28 Aug 2009,"Cleanup: Remove more traces of old squid debug()() macro

There is now no reason for any of the Squid internal code to contain 'debug()'

TODO: Just the ESI code remaining on the old system.
  It's debug seems to be incrementally building a single line to display
  objects parsed. But using multiple nested calls to dump it.
  VERY nasty. They need to be made writing to a buffer instead.",78,data/crawl/squid/patch_758.diff
https://github.com/squid-cache/squid/commit/c19c2c0bf9fe61e3caf3406692f3acccfa40a2e3,27 Aug 2009,Meld helper_debug into old debug. Now reserved for helepers,64,data/crawl/squid/patch_759.diff
https://github.com/squid-cache/squid/commit/a0e95c7e26b33cb3df67c566e0daf382738da3ea,27 Aug 2009,"Cleanup of auth header special case forwarding logics

The code dealing with our special case auth header forwarding/synthesising
had grown quite hairy and partially duplicated from all additions. This
cleans up the code moving this logics to a new function and unifying
WWW & Proxy auth cases.",186,data/crawl/squid/patch_760.diff
https://github.com/squid-cache/squid/commit/0606266fc8b9a44b2b6afb501fb346f3e59de875,27 Aug 2009,Use the right auth header type for the context,6,data/crawl/squid/patch_761.diff
https://github.com/squid-cache/squid/commit/ee0b94f4b7d2c3281a98eff2706f8e32d812bee3,26 Aug 2009,"Rework the auth forwarding special cases

The auth forwarding special cases had grown a bit hairy with a lot
of duplicated code between WWW-Auth and Proxy-Auth and far from trivial
to follow code logics.

This change breaks this logic out to a separate function shared
in both modes, selecing mode based on type of peer.

Also moves PROXYPASS back into the land of undocumented features. This
is a feature which most would only get confused by and which can cause
significant security issues if used wrongly.",184,data/crawl/squid/patch_762.diff
https://github.com/squid-cache/squid/commit/fd06c01fc51a0ff1c7bda7d27b79b6eb025f84bc,24 Aug 2009,Drop helper.cc changes,10,data/crawl/squid/patch_763.diff
https://github.com/squid-cache/squid/commit/e13816381e77a355099d4673cbe38e11f0fdfec2,23 Aug 2009,SourceFormat: enforcement,1601,data/crawl/squid/patch_764.diff
https://github.com/squid-cache/squid/commit/33380a2d5fbf3ee58c1b8026347e461356c2ba57,23 Aug 2009,SourceFormat: report broken file and continue after errors.,41,data/crawl/squid/patch_765.diff
https://github.com/squid-cache/squid/commit/2f7be300e1a596e5fbc66a74c129eef744197ce6,23 Aug 2009,SourceFormat: mswin_sspi helper,412,data/crawl/squid/patch_766.diff
https://github.com/squid-cache/squid/commit/bbaf26850faf3e4feb62c38ef7807c10e2237de0,15 Aug 2009,"Author: Mark Nottingham <mnot@pobox.com>
Bug 2390: New hier_code ACL type

I needed to log only forward requests; forward_log looked interesting, but
isn't flexible like access_log. The easiest thing to do seemed to be to add a
hier_code ACL type.

Adapted to Squid-3 by Amos Jeffries",326,data/crawl/squid/patch_767.diff
https://github.com/squid-cache/squid/commit/c6111665d4d240d094f6b29a622389bc3676e401,14 Aug 2009,"Populate cache_mem again on disk cache hits, moving on-disk objects back
into the hot object pool.

This adds a new squid.conf option for tuning when to keep objects in memory.

Sponsored by: The Measurement Factory",181,data/crawl/squid/patch_768.diff
https://github.com/squid-cache/squid/commit/766743af0e72dc241510f65bc660dbd2eaca9420,13 Aug 2009,"Windows port: fix mswin_negotiate_auth.exe crash when executing a LocalCall authentication with verbose debug enabled

- Also ran indent",414,data/crawl/squid/patch_769.diff
https://github.com/squid-cache/squid/commit/2e1e4f10bd3ccc01183d99a9cb466f3bc483c5da,10 Aug 2009,merged from trunk,5048,data/crawl/squid/patch_770.diff
https://github.com/squid-cache/squid/commit/dcb802aa7ae3d63d5897bbe9260abc6533f48717,04 Aug 2009,"Bug #2648: stateful helpers stuck in reserved if client disconnects while helper busy

Note: May depend on the other stateful helper cleanups.",72,data/crawl/squid/patch_771.diff
https://github.com/squid-cache/squid/commit/ea21d49788dbca1dfa77822fa736c79c813d5648,04 Aug 2009,Unify memory_cache_first/disk into a single memory_cache_mode directive,73,data/crawl/squid/patch_772.diff
https://github.com/squid-cache/squid/commit/86ea30a69b4b6a1501ecf931b80248d85cd52693,03 Aug 2009,"Remove support for deferred state in stateful helpers

the deferred state were previously used for the challenge reuse mode
in NTLM, but is since long unused as it was both incompatible with
NTLMv2 and also not very stable for authentication.",283,data/crawl/squid/patch_773.diff
https://github.com/squid-cache/squid/commit/d20ce97d2485243522542bcd8adb52839a3e8b54,02 Aug 2009,Cut away the deferred helper state,267,data/crawl/squid/patch_774.diff
https://github.com/squid-cache/squid/commit/d7e0f901f9e577ab6bfbba6402160e05e531ef14,02 Aug 2009,Cleanup: Boost helper shutdown debugs and state display,28,data/crawl/squid/patch_775.diff
https://github.com/squid-cache/squid/commit/0f9db2d67591759c0b85658564013246599e7f63,26 Jul 2009,"Add Unit-Tests for HttpReply

Just the basics for some needed right now. This needs to be expanded.

Also, required to break some of the mime header parsing calls out into
mime_header.cc in preparation for splitting the icon handling from the
header handling and reduce dependencies on the new tests.",656,data/crawl/squid/patch_776.diff
https://github.com/squid-cache/squid/commit/d974a0723c00b59328754bbd964e34fdd03a890a,17 Jul 2009,"Bug 2680 regression: Crash after rotate with no helpers running

Regression from bug 2276 fix. n_running was used instead of n_active.
Also documents the relevant counters to prevent this recurring.",30,data/crawl/squid/patch_777.diff
https://github.com/squid-cache/squid/commit/a22e6cd3b6e8889984d266816aaea8fcf27ee13d,13 Jul 2009,"Support adaptation sets and chains, including dynamic ICAP chains:

  - Support adaptation service sets and chains
    (adaptation_service_set and adaptation_service_chain)

  - Dynamically form chains based on ICAP X-Next-Services header
    (icap_service routing=on)

  - Support cross-transactional ICAP header exchange
    (adaptation_masterx_shared_names)


An adaptation service set contains similar, interchangeable services. No more
than one service is successfully applied. If one service is down or fails,
Squid can use another service. Think ""hot standby"" or ""spare"" ICAP servers. 

Sets may seem similar to the existing ""service bypass"" feature, but they allow
the failed adaptation to be retried and succeed if a replacement service is
available. The services in a set may be all optional or all essential,
depending on whether ignoring the entire set is acceptable. The mixture of
optional and essential services in a set is supported, but yields results that
may be difficult for a human to anticipate or interpret. Squid warns when it
detects such a mixture.

When performing adaptations with a set, failures at a service (optional or
essential, does not matter) are retried with a different service if possible.
If there are no more replacement services left to try, the failure is treated
depending on whether the last service tried was optional or essential: Squid
either tries to ignore the failure and proceed or terminates the master
transaction.


An adaptation chain is a list of different services applied one after another,
forming an adaptation pipeline. Services in a chain may be optional or
essential. When performing adaptations, failures at an optional service are
ignored as if the service did not exist in the chain.

Request satisfaction terminates the adaptation chain.


When forming a set or chain for a given transaction, optional down services
are ignored as if they did not exist.

ICAP and eCAP services can be mixed and matched in an adaptation set or chain.


Merged from 3p1-plus branch at r9513.


* Implementation notes

The notes below focus on _changes_. Adaptation terminology and current layers
are now being documented in src/adaptation/notes.dox

Service sets and chains are implemented as ServiceGroup class kids. They are
very similar in most code aspects. The primary external difference is that
ServiceSet can ""replace"" a service and ServiceChain can find the ""next""
service.  The internal search code is implemented in ServiceGroup parent and
is parametrized by the kids.

Before the adaptation starts, Squid calculates the adaptation ""plan"", which is
just an iterator into the ServiceGroup. The client- and server-side adaptation
initiators used to deal with Service pointers. They now deal with ServiceGroup
pointers. The only interesting difference is that a ServiceGroup does not have
a notion of being optional or essential. Thus, if adaptation start fails, we
do not know whether the failure can be bypassed. Fortunately, starting an
adaptation does not require anything that depends on the adaptation services,
so we now simply assert that the start succeeds.

If the entire adaptation fails, the callers are notified as before. They are
told whether they can ignore the failure as before. No changes there.

A new Adaptation::Iterator class has been added to execute the adaptation
plan. That class is responsible for iterating the services in a service group
until the plan is exhausted or cannot progress due to a final failure. 


Dynamically form adaptation chains based on the ICAP X-Next-Services header.

If an ICAP service with the routing=1 option in squid.conf returns an ICAP
X-Next-Services response header during a successful REQMOD or RESPMOD
transaction, Squid abandons the original adaptation plan and forms a new
adaptation chain consisting of services identified in the X-Next-Services
header value (using a comma-separated list of adaptation service names from
squid.conf).  The dynamically created chain is destroyed once the new plan is
completed or replaced.

This feature is useful when a custom adaptation service knows which other
services are applicable to the message being adapted.

Limit adaptation iterations to adaptation_service_iteration_limit to protect
Squid from infinite adaptation loops caused by ICAP services constantly
including themselves in the dynamic adaptation chain they request. When the
limit is exceeded, the master transaction fails. The default limit of 16
should be large enough to not require an explicit configuration in most
environments yet may be small enough to limit side-effects of loops.

TODO: Add metadata support to eCAP API and honor X-Next-Services there as
well. Currently, only ICAP services can form dynamic chains but the formed
chains may contain eCAP services.


Other improvements:

Polished adaptation service configuration in squid.conf. Old format with an
anonymous bypass option is deprecated but still supported. Quit with a fatal
message if an adaptation service is misconfigured (debugging level-0 messages
do not seem to work at that stage, but that is probably another, general bug).


Polished HttpRequest::adaptHistory() interface so that the code that knows the
history is needed can force history creation without complex
configuration-time preparations and state. Currently, all adaptation history
users but the logging-related ones know runtime whether the history must be
created (e.g., when a certain ICAP header is received).


Fixed ""canonical"" Request URL maintenance when ICAP clones requests.
TODO: The urlCanonical() must become HttpRequest::canonical(), hiding the
often out-of-sync canonical data member.


Fixed ICAP request parsing (for ICAP logging). We used to parse Request-Line
as if it were the first header. TODO: optimize by parsing only when needed.


Fixed AccessCheck case where a service group disappears during a nb ACL check.
Replaced ""done"" member with an existing AsyncJob mustStop mechanism. Removed
extra async call as unneeded because ACL callbacks are already async.",1718,data/crawl/squid/patch_778.diff
https://github.com/squid-cache/squid/commit/3ff6559699bc1852ae3a6f7be48824d13e2ebf90,12 Jul 2009,"Bug #2459 fix, access logging enhancements, ICAP logging and retries support:

  - Bug #2459 fix

  - Support logging of total DNS wait time to access.log
    (%dt)

  - Support logging response times of adaptation transactions to access.log
    (%adapt::sum_trs and %adapt::all_trs)

  - Enhanced access logging
    (<Hs, <sh, >sh, <pt, <tt, icap::tt, and icap::<last_h in squid.conf)
    
  - ICAP logging 
    (see icap_log and log_icap in squid.conf as well as
    http://wiki.squid-cache.org/Features/AdaptationLog).
    
  - ICAP retries based on the ICAP responses status code
    (see icap_retry_limit in squid.conf).

Merged from 3p1-plus branch at r9511.",2714,data/crawl/squid/patch_779.diff
https://github.com/squid-cache/squid/commit/e41db37b10eb9b0f41876e7287477a17e86d1250,12 Jul 2009,"Author: Markus Moeller <huaraz@moeller.plus.com>
Bug 2710: squid_kerb_auth non-terminated string",38,data/crawl/squid/patch_780.diff
https://github.com/squid-cache/squid/commit/fdbb3b19d56573065b7e392e27161ae77ce85aaa,11 Jul 2009,"Add url_rewrite helper section

 - Introduces --enable-url-rewrite-helpers configure option
   identical to other helper options. Selects which of the new helpers to build.

 - Adds a fake url_rewrite program in C++ binary and shell scripts formats
   each perform no re-write but can log all requests made.

TODO:
 * add other helpers for various purposes.
 * make these demo/debug helpers capable of concurrent requests",253,data/crawl/squid/patch_781.diff
https://github.com/squid-cache/squid/commit/233b0db14fc8ab4272167cfd0fe4e9dff9d81120,11 Jul 2009,"Additional info for stateful helper status page

 - split R and D states.
 - clarify meaning of S (pending! not completed) state
 - add time spent in reserved state",21,data/crawl/squid/patch_782.diff
https://github.com/squid-cache/squid/commit/b1fb334820e3a4e7be5887062fc5bf72ca2f1fcb,28 Jun 2009,"Delay pools 64-bit buckets and IPv6-polish

This patch adds some polish and minor unfinished business in IPv6 
support vs delay pools.

Also updates the bucket size to 64-bytes to allow for >4MB traffic caps. 

TODO: Bump up the refresh size for >4MB/sec flows and check that nothing
      gets broken by it.",118,data/crawl/squid/patch_783.diff
https://github.com/squid-cache/squid/commit/7015d4eb4c0127faad2180b93e996bad6d9935ff,28 Jun 2009,"Author: Francesco Chemolli <kinkie@squid-cache.org>
Bug 2092: Changed select loop call counter to 64-bit

... unsigned long int so that it won't wrap around so easily.",22,data/crawl/squid/patch_784.diff
https://github.com/squid-cache/squid/commit/6b8e8ace69052065c84e32531cf5b88838ca5733,23 Jun 2009,merge from trunk,5182,data/crawl/squid/patch_785.diff
https://github.com/squid-cache/squid/commit/b61a58df52fc37f31394bc81be426a576e0b75d2,22 Jun 2009,"Make gcc 4.4 happy with 3.1 libraries

 - Fixes libecap build fubar
 - Fixes libbase circular dependencies for ufsdump",28,data/crawl/squid/patch_786.diff
https://github.com/squid-cache/squid/commit/f381d699463a8428ce72038b028ad41185545de6,12 Jun 2009,"Bug 2395: FTP auth errors not displayed

Round 2 for this bug. Now we handle missing auth as an expected result
rather than a failure. FTP operations are now well tested and this patch
does not affect code shared with other components.

Side-effect is that browser authentication popups now appear when the
FTP server needs authentication. This has been a long missed event.

The root cause of the issue is not found so other subsequent errors in
FTP sub-protocol still silently lost due to the same issue.",192,data/crawl/squid/patch_787.diff
https://github.com/squid-cache/squid/commit/68924b6db6e4dfe2e74495543c075714803812aa,31 May 2009,"Author: Henrik Nordstrom <henrik@henriknordstrom.net>
Bug #2407: Spelling error in http_port tcpkeepalive option

One of the new parameters according to the docs is ""keepalive"". However, when
using this option you'll get a ""Bungled squid.conf in line ..."". That's because
when parsing the configuration Squid is looking for the keyword ""tcpkeepalive""
instead of ""keepalive"" as stated in the docs.

Selected to fix the docs instead of code as having it named keepalive is too
easily confused with HTTP keep-alive / persistent connections.


2009-05-25: Also mistakes on spelling of config dump.",6,data/crawl/squid/patch_788.diff
https://github.com/squid-cache/squid/commit/d376ccbf3b2dd2a6d90c5e7ea2f1dfdb3b9aee28,19 May 2009,"Shuffle dnsserver -s option into its own function call.

This is prep for bug 2147 closure.",154,data/crawl/squid/patch_789.diff
https://github.com/squid-cache/squid/commit/445d18a460422224933c2d3b964dce27270bb402,18 May 2009,"Move ASN handling for ACL into ACL area.

This removes one possble compile clash, and one empty file.",1279,data/crawl/squid/patch_790.diff
https://github.com/squid-cache/squid/commit/ff9970cc48d27a18cc5140eddfeb15e7348bd118,08 May 2009,"Author: Mark Nottingham <mnot@pobox.com>
Make PEER_TCP_MAGIC_COUNT configurable

Squid will consider a peer dead when it has ten connect failures; this is
hardcoded in as PEER_TCP_MAGIC_COUNT.

The attached patch makes it a per-peer configuration option, defaulting to
PEER_TCP_MAGIC_COUNT.",27,data/crawl/squid/patch_791.diff
https://github.com/squid-cache/squid/commit/4ca08219d6fc002e18a32b3eee4042577324dc0c,08 May 2009,"Author: Mark Nottingham <mnot@pobox.com>
Bug 2645: allow squid to ignore must-revalidate",38,data/crawl/squid/patch_792.diff
https://github.com/squid-cache/squid/commit/bdcd85c36c1373c6ba80618405bcfe36d1ae9601,27 Apr 2009,Handle several IO errors cleanly.,15,data/crawl/squid/patch_793.diff
https://github.com/squid-cache/squid/commit/277594848931fd7f19a61dfbd2c923ff06922311,27 Apr 2009,"Remove infinite loop in MSNT auth helper

On one starting error condition the helper enters a read loop     
without exit conditions. Made this exit when read was done
and shutdown helper as per behavior comment by the loop.

Also removes one useless goto.",10,data/crawl/squid/patch_794.diff
https://github.com/squid-cache/squid/commit/31be869c4c5d3c3ca53e73170d739a35cd6fd937,12 Apr 2009,"Bug 2571: Squid with IPv6 fails to start on kernel without IPv6

Adds comm_open_listener() wrapper to perform IPv6/IPv4 failover on sockets
intended for listening only. Uses the wrapper in all places I can be sure of.

Open a port specially bound for listening or sending through a specific port.
This is a wrapper providing IPv4/IPv6 failover around comm_openex().
Please use for all listening sockets and bind() outbound sockets.

It will open a socket bound for:
  - IPv4 if IPv6 is disabled or address is IPv4-native.
  - IPv6 if address is IPv6-native
  - IPv6 dual-stack mode if able to open [::]

When an open performs failover it update the given address to feedback
the new IPv4-only status of the socket. Further displays of the IP
(in debugs or cachemgr) will occur in Native IPv4 format.
A reconfigure is needed to reset the stored IP in most cases and attempt
a port re-open.",88,data/crawl/squid/patch_795.diff
https://github.com/squid-cache/squid/commit/6249367873059fd0bd2ac44a05e9eb306eb03f76,12 Apr 2009,"Detatch debugs() from many of its dependencies

 - makes cache.log independent of the other logging systems
 - adds debug_options rotate=N setting
 - moves debug-specific globals and types into Debug::

TODO:
  remove remaining dependancy on shutdown flag
  polish up namespace etc for libdebug",242,data/crawl/squid/patch_796.diff
https://github.com/squid-cache/squid/commit/af6a12ee06b934ccc12bdfdcef233481a7806a21,07 Apr 2009,"Author: Source maintenance
Source Format enforcement",1314,data/crawl/squid/patch_797.diff
https://github.com/squid-cache/squid/commit/29cb1a9a08f9443a8b8ec75994cb9e506fe21f27,04 Apr 2009,The debug mode option '-d' was not documented in LDAP helpers usage message,2,data/crawl/squid/patch_798.diff
https://github.com/squid-cache/squid/commit/2f0b84f7ed4d332dd31c10ebeae2b1f49fea5f3c,01 Apr 2009,"Purge last remnants of inet_ntoa

 - Now fully replaced by IPAddress::NtoA and inet_ntop()
 - No need for the third-party emulator and license either",148,data/crawl/squid/patch_799.diff
https://github.com/squid-cache/squid/commit/0a51587682d1b9ff2ad6a8fbb741d41ccb895d09,26 Mar 2009,Changed select loops counter from int to unsigned long int.,22,data/crawl/squid/patch_800.diff
https://github.com/squid-cache/squid/commit/2d51c9088d676bc2c47a4bc01152889d9162ab87,13 Mar 2009,"SourceLayout: acl/, take 1

Moved src/ACL* and a few related files into src/acl/.
Renamed ACL source files from ACLFoo.{cc,cci,h} to Foo.{cc,cci,h}.

Added acl/ libraries, reorganized auth/ libraries, and split ACLChecklist
class to avoid circular dependencies among libraries.

Many targets in src/Makefile.am depended on selected ACL ACL*cc and related
sources.  These targets depend on acl/* libraries now. As a part of this
cleanup, the number of ufsdump sources went from about 160 to about 20.

No functionality changes were intended. Source code changes were kept to the
minimum. All my build tests are successful. However, since I had to move a lot
of files, move some code pieces, and split ACLChecklist, it is possible that
some targets will no longer build in some environments and some authentication
code will break.

Please see individual commit messages for details.",2511,data/crawl/squid/patch_801.diff
https://github.com/squid-cache/squid/commit/6ada3123cae4373866496e90f498b39f2a509494,08 Mar 2009,"Moved authenticated() method from ACL[Filled]Checklist into auth/Acl.{cc,h} to
break the circular dependency between acl/libs and auth/libs.

Context: SourceLayout: acl/, take 1",90,data/crawl/squid/patch_802.diff
https://github.com/squid-cache/squid/commit/74544ee3ea97c41a4ed832bd4efe45f954d3fbcf,08 Mar 2009,"Removed some 140 SOURCEs of ufsdump, adding a few stubs. The program seems to
work on simple ufs cache files.

urlCanonical is currently an always-asserting stub. I am not sure what pulls
in urlCanonical. I know storeKeyPublicByRequest* require it, but I am not sure
which source requires storeKeyPublicByRequest. If the stub assertion fails on
some cache files, we will need to pull more sources or re-implement
urlCanonical.

The more sources are moved into libraries, the more difficult it may be to
write isolated, compact test cases or tools because test case stubs and
customizations may start to conflict with names defined in the libraries and
because pulling in a whole library might require defining more stubs. It is
not clear yet how real this concern is in general, but a lot of acl/
SourceLayout time was spent on making ufsdump build...

Context: SourceLayout: acl/, take 1",32,data/crawl/squid/patch_803.diff
